COD_TIPO_DATO;TIPO_DATO;IDENTIFICADOR_MINT;COD_ELEMENTO;COD_NDP;DIRECCION_COMPLETA;DIRECCION AUXILIAR;CENTRO;COD_VIAL;CLASE_VIAL;PARTICULAS_VIAL;NOMBRE_VIAL;TIPO_NÚMERO;NÚMERO;COD_BARRIO;BARRIO;COD_DISTRITO;DISTRITO;UTMX;UTMY;LATITUD;LONGITUD;HORARIO;OBSERVACIONES
;contenedor de aceite;;;;Calle  Galileo, 39;;Punto limpio de proximidad - Centro Cultural Galileo;;Calle;;Galileo;número;39;;;07;Chamberí;439737,14;4476140,05;40,43372;-3,7105;Lunes a Viernes 8:30 a 21:30. Sábados y Domingos 9:30 a 20:30.;
;contenedor de aceite;;;;Calle  Concejo de Teverga, 1;;Punto limpio de proximidad - Centro Cultural Lope de Vega;;Calle;;Concejo de Teverga;número;1;;;13;Puente de Vallecas;442995,89;4470873,96;40,38651;-3,67161;Lunes a Viernes 9:00 a 13:30 y de 17:00 a 19:00.;
;contenedor de aceite;;;;Calle  Princesa de Éboli, 29;;Punto limpio de proximidad - Centro Cultural Sanchinarro;;Calle;;Princesa de Éboli;número;29;;;16;Hortaleza;444462,27;4482376,5;40,49023;-3,65534;Lunes a Viernes 9:00 a 22:00. Sábados y Domingos 10:00 a 22:00.;
;contenedor de aceite;;;;Calle  Monseñor Oscar Romero, 41;;Punto limpio de proximidad - Centro Deportivo Municipal La Mina;;Calle;;Monseñor Oscar Romero;número;41;;;11;Carabanchel;436628,76;4470466,57;40,38238;-3,74658;Lunes a Viernes 9:00 a 20:30. Sábados y Domingos  9:00 a 14:30.;
;contenedor de aceite;;;;Calle  Puerto de Reinosa, 2;;Punto limpio de proximidad - Instalación Deportiva Básica Virgen de la Torre;;Calle;;Puerto de Reinosa;número;2;;;18;Villa de Vallecas;447619,64;4469935,59;40,37836;-3,61706;Lunes a Viernes 17:00 a 21:00. Sábados y Domingos 9:00 a 18:00.;
;contenedor de aceite;;;;Plaza  Moncloa, 1;;Punto limpio de proximidad - Junta Municipal de Distrito de Moncloa-Aravaca;;Plaza;;Moncloa;número;1;;;09;Moncloa-Aravaca;439054,11;4476324,29;40,43533;-3,71857;Lunes a Jueves 8:30 a 15:00. Viernes 8:30 a 14:00.;Sábados y Domingos cerrado
;contenedor de aceite;;;;Calle  Alameda, 15;;Punto limpio de proximidad - Medialab-Prado;;Calle;;Alameda;número;15;;;01;Centro;441152,05;4473553,45;40,41052;-3,69358;Lunes 16:00 a 21:00. Martes a Viernes 10:00 a 21:00. Sábados 11:00 a 21:00.;
;contenedor de aceite;;;;Avenida  Asturias, 2;;Mercadillo en la vía pública de avenida de Asturias;;Avenida;;Asturias;número;2;;;6;Tetuán;441487,73;4479809,38;40,4669;-3,6902;Domingos y festivos 9:00 a 14:00;
;contenedor de aceite;;;;Camino  Cruces, 6;;Mercadillo en la vía pública de Camino de las Cruces ;;Camino;;Cruces;número;6;;;11;Carabanchel;435872,81;4469620,45;40,3747;-3,7554;Lunes 9:00 a 14:00;excepto festivos.
;contenedor de aceite;;;;Calle  San Leandro, 9;;Mercadillo en la vía pública de El Pardo ;;Calle;;San Leandro;número;9;;;08;Fuencarral-El Pardo;434290,01;4485530,62;40,5179;-3,7757;Viernes 9:00 a 14:00;
;contenedor de aceite;;;;Calle  Silvano, 71;;Mercadillo en la vía pública de la calle Alcorisa - camino Silvano ;;Calle;;Silvano;número;71;;;16;Hortaleza;445701,01;4479178,19;40,4615;-3,6405;Martes y Sábados 9:00 a 14:00;
;contenedor de aceite;;;;Calle  Aragoneses, 1;;Mercadillo en la vía pública de la calle Aragoneses;;Calle;;Aragoneses;número;1;;;13;Puente de Vallecas;445343,68;4470400,27;40,3824;-3,6439;Lunes 9:00 a 14:00;
;contenedor de aceite;;;;Calle  Ayerbe, 22;;Mercadillo en la vía pública de la calle Ayerbe ;;Calle;;Ayerbe;número;22;;;21;Barajas;451049,17;4480184,75;40,4709;-3,5775;Sábados 9:00 a 14:00;excepto durante las fiestas del distrito que se celebran en septiembre
;contenedor de aceite;;;;Calle  Ramón Pérez de Ayala, 17;;Mercadillo en la vía pública de la calle Fontarrón;;Calle;;Ramón Pérez de Ayala;número;17;;;13;Puente de Vallecas;444761,28;4472236,11;40,3989;-3,6509;Jueves 9:00 a 14:00;
;contenedor de aceite;;;;Calle  Gandhi, 16;;Mercadillo en la vía pública de la calle Gandhi ;;Calle;;Gandhi;número;16;;;15;Ciudad Lineal;445940,22;4475080,35;40,4246;-3,6373;Viernes 9:00 a 14:00;
;contenedor de aceite;;;;Calle  Vicente Quesada, 4;;Mercadillo en la vía pública de la calle Gorrión ;;Calle;;Vicente Quesada;número;4;;;11;Carabanchel;438026,51;4472066,71;40,3969;-3,7303;Lunes 9:00 a 14:00;excepto festivos
;contenedor de aceite;;;;Calle  San Roman del Valle, 8;;Mercadillo en la vía pública de la calle San Román del Valle ;;Calle;;San Roman del Valle;número;8;;;20;San Blas-Canillejas;447255,96;4474593,66;40,4203;-3,6217;Martes 9:00 a 14:00;
;contenedor de aceite;;;;Avenida  Trece Rosas, 9;;Mercadillo en la vía pública de la calle Santa Genoveva ;;Avenida;;Trece Rosas;número;9;;;15;Ciudad Lineal;445110,22;4475268,44;"40,42624
";" -3,64708
";Jueves y sábados 9:00 a 14:00;excepto durante las fiestas del distrito celebradas durante dos semanas de septiembre
;contenedor de aceite;;;;Calle  Sierra Gorda, 31;;Mercadillo en la vía pública de la calle Sierra Gorda ;;Calle;;Sierra Gorda;número;31;;;18;Villa de Vallecas;447536,8;4470229,21;40,381;-3,61807;Martes 9:00 a 14:00.;
;contenedor de aceite;;;;Calle  Villablanca, 87;;Mercadillo en la vía pública de la calle Villablanca ;;Calle;;Villablanca;número;87;;;19;Vicálvaro;448696,23;4473173,91;40,4076;-3,6046;Jueves 9:00 a 14:00;excepto jueves santo y fiestas del Distrito (celebradas en junio)
;contenedor de aceite;;;;Paseo  Gigantes Y Cabezudos, 54;;Mercadillo en la vía pública de la colonia Ciudad de los Ángeles ;;Paseo;;Gigantes Y Cabezudos;número;54;;;17;Villaverde;441087,14;4467335,42;40,3545;-3,6938;Jueves 9:00 a 14:00;
;contenedor de aceite;;;;Calle  San Eustaquio, 29;;Mercadillo en la vía pública de la colonia Marconi ;;Calle;;San Eustaquio;número;29;;;17;Villaverde;440448,08;4464921,65;40,3327;-3,7011;Domingos 9:00 a 14:00;
;contenedor de aceite;;;;Avenida  Orcasur, 60;;Mercadillo en la vía pública de Orcasur ;;Avenida;;Orcasur;número;60;;;13;Usera;440561,44;4468834,8;40,3680;-3,7001;Sábados 9:00 a 14:00;
;contenedor de aceite;;;;Plaza  Campillo del Mundo Nuevo, 3;;Mercadillo en la vía pública de Parque de la Cornisa ;;Plaza;;Campillo del Mundo Nuevo;número;3;;;01;Centro;439926,67;4473116,92;40,4065;-3,7080;Martes y Sábados 9:00 a 14:00;excepto festivos.
;contenedor de aceite;;;;Avenida  Poblados, 62;;Mercadillo en la vía pública de Rafael Finat ;;Avenida;;Poblados;número;62;;;10;Latina;435389,33;4470756,87;40,3849;-3,7612;Sábados 9:00 a 14:00;
;contenedor de aceite;;;;Ronda  Sur, 231;;Mercadillo en la vía pública de ronda del Sur ;;Ronda;;Sur;número;231;;;13;Puente de Vallecas;443704,06;4469435,54;40,3736;-3,6631;Domingos 9:00 a 14:00;
;contenedor de aceite;;;;Calle  Burjasot, 1;;Mercadillo en la vía pública de San Cristóbal de los Ángeles ;;Calle;;Burjasot;número;1;;;17;Villaverde;441662,76;4466220,88;40,3445;-3,6869;Jueves 9:00 a 14:00;
;contenedor de aceite;;;;Calle  San Restituto, 24;;Mercadillo en la vía pública de San Restituto ;;Calle;;San Restituto;número;24;;;09;Moncloa-Aravaca;439636,3;4479624,27;40,4651;-3,7120;Jueves 9:00 a 14:00;
;contenedor de aceite;;;;Calle  San Cugat del Valles, 8;;Mercadillo en la vía pública de Santa Ana ;;Calle;;San Cugat del Valles;número;8;;;08;Fuencarral-El Pardo;441081,61;4483142,8;40,4969;-3,6953;Miércoles 9:00 a 14:00;
;contenedor de aceite;;;;Calle  Via Lusitana, 2;;Mercadillo en la vía pública de Vía Lusitana;;Calle;;Via Lusitana;número;2;;;11;Carabanchel;438885,25;4470694,29;40,3846;-3,7200;Jueves 9:00 a 14:00;excepto festivos
;contenedor de aceite;;;;Paseo  Ferroviarios, 2;;Mercadillo en la vía pública de Villaverde Alto;;Paseo;;Ferroviarios;número;2;;;17;Villaverde;439280,66;4466683,77;40,3485;-3,7150;Sábados 9:00 a 14:00;
;contenedor de aceite;;;;Carretera  Estación de Hortaleza, 16;;Mercadillo en la vía pública UVA Hortaleza ;;Carretera;;Estación de Hortaleza;número;16;;;16;Hortaleza;444774,66;4481183,09;40,4795;-3,6516;Domingos 9:00 a 14:00;
;contenedor de aceite;;;;Calle  Barceló, 6;;Punto limpio de proximidad - Mercado de Barceló;;Calle;;Barceló;número;6;;;01;Centro;440719,17;4475360,72;40,42677;-3,69885;Todos los días, 24 horas;Situado en vía pública, fuera del mercado
;contenedor de aceite;;;;Calle  Zarza, 20;;Punto limpio de proximidad - Oficina auxiliar Atención a la Ciudadanía de Aravaca;;Calle;;Zarza;número;20;;;09;Moncloa-Aravaca;433370,48;4478937;40,45843;-3,78585;Lunes a Viernes 8:30 a 14:00.;Cerrado el mes de agosto, los sábados y los días 24 y 31 de diciembre
;contenedor de aceite;;;;Calle  Casino, 3;;Punto limpio de proximidad - Parque Casino de la Reina;;Calle;;Casino;número;3;;;01;Centro;440177,22;4473143,78;40,40676;-3,70503;Lunes a Viernes 8:30 a 21:30. Sábados 10:00 a 15:00 y de 16:00 a 21:30.;Domingos Cerrado
;contenedor de aceite;;;;Calle  Estrella Denébola, 5;;Punto Limpio Fijo;;Calle;;Estrella Denébola;número;5;;;21;Arganzuela;442002,30;4471733,89;40,39418;-3,6833972;Lunes a Sabado 8:00 a 20:00. Domingo y festivos 9:00 a 14:00.  24 y 31 de diciembre 8:00 a 14:00. 25 de diciembre y 1 y 6 enero CERRADO.;
;contenedor de aceite;;;;Avenida  Alfonso XIII (Entrada junto gasolinera), 128;;Punto Limpio Fijo;;Avenida;;Alfonso XIII (Entrada junto gasolinera);número;128;;;05;Chamartin;443406,00;4478883,97;40,458687;-3,6674913;Lunes a Sabado 8:00 a 20:00. Domingo y festivos 9:00 a 14:00.  24 y 31 de diciembre 8:00 a 14:00. 25 de diciembre y 1 y 6 enero CERRADO.;
;contenedor de aceite;;;;Paseo  Senda Del Rey, 20;;Punto Limpio Fijo;;Paseo;;Senda Del Rey;número;20;;;09;Moncloa-Aravaca;437241,29;4478163,57;40,451758;-3,740127;Lunes a Sabado 8:00 a 20:00. Domingo y festivos 9:00 a 14:00.  24 y 31 de diciembre 8:00 a 14:00. 25 de diciembre y 1 y 6 enero CERRADO.;
;contenedor de aceite;;;;Calle  Concejal Francisco José Jiménez Martín, 5;;Punto Limpio Fijo;;Calle;;Concejal Francisco José Jiménez Martín;número;5;;;10;Latina;437567,78;4472487,95;40,400651;-3,7357254;Lunes a Sabado 8:00 a 20:00. Domingo y festivos 9:00 a 14:00.  24 y 31 de diciembre 8:00 a 14:00. 25 de diciembre y 1 y 6 enero CERRADO.;
;contenedor de aceite;;;;Calle  Cristo de la Victoria, 245;;Punto Limpio Fijo;;Calle;;Cristo de la Victoria;número;245;;;12;Usera;439780,29;4470024,57;40,378626;-3,7094159;Lunes a Sabado 8:00 a 20:00. Domingo y festivos 9:00 a 14:00.  24 y 31 de diciembre 8:00 a 14:00. 25 de diciembre y 1 y 6 enero CERRADO.;
;contenedor de aceite;;;;Calle  José Paulete, 43;;Punto Limpio Fijo;;Calle;;José Paulete;número;43;;;13;Puente de Vallecas;444457,54;4471703,42;40,394077;-3,6544689;Lunes a Sabado 8:00 a 20:00. Domingo y festivos 9:00 a 14:00.  24 y 31 de diciembre 8:00 a 14:00. 25 de diciembre y 1 y 6 enero CERRADO.;
;contenedor de aceite;;;;Calle  Arroyo de la Media Legua, 72;;Punto Limpio Fijo;;Calle;;Arroyo de la Media Legua;número;72;;;14;Moratalaz;444743,35;4473976,82;40,414572;-3,6512965;Lunes a Sabado 8:00 a 20:00. Domingo y festivos 9:00 a 14:00.  24 y 31 de diciembre 8:00 a 14:00. 25 de diciembre y 1 y 6 enero CERRADO.;
;contenedor de aceite;;;;Avenida  Daroca, 104;;Punto Limpio Fijo;;Avenida;;Daroca;número;104;;;15;Ciudad Lineal;446492,29;4474351,57;40,418065;-3,6307143;Lunes a Sabado 8:00 a 20:00. Domingo y festivos 9:00 a 14:00.  24 y 31 de diciembre 8:00 a 14:00. 25 de diciembre y 1 y 6 enero CERRADO.;
;contenedor de aceite;;;;Calle  Tomas Redondo, 8;;Punto Limpio Fijo;;Calle;;Tomas Redondo;número;8;;;16;Hortaleza;446787,13;4480107,77;40,469937;-3,6277195;Lunes a Sabado 8:00 a 20:00. Domingo y festivos 9:00 a 14:00.  24 y 31 de diciembre 8:00 a 14:00. 25 de diciembre y 1 y 6 enero CERRADO.;
;contenedor de aceite;;;;Calle  Bascuñuelos, 3;;Punto Limpio Fijo;;Calle;;Bascuñuelos;número;3;;;17;Villaverde;439669,92;4465584,15;40,33862;-3,7103035;Lunes a Sabado 8:00 a 20:00. Domingo y festivos 9:00 a 14:00.  24 y 31 de diciembre 8:00 a 14:00. 25 de diciembre y 1 y 6 enero CERRADO.;
;contenedor de aceite;;;;Calle  Luis I, 36;;Punto Limpio Fijo;;Calle;;Luis I;número;36;;;18;Villa de Vallecas;445357,98;4469698,39;40,376074;-3,6436928;Lunes a Sabado 8:00 a 20:00. Domingo y festivos 9:00 a 14:00.  24 y 31 de diciembre 8:00 a 14:00. 25 de diciembre y 1 y 6 enero CERRADO.;
;contenedor de aceite;;;;Calle  Sepiolita, 6;;Punto Limpio Fijo;;Calle;;Sepiolita;número;6;;;19;Vicálvaro;449197,47;4473082,50;40,406802;-3,5987301;Lunes a Sabado 8:00 a 20:00. Domingo y festivos 9:00 a 14:00.  24 y 31 de diciembre 8:00 a 14:00. 25 de diciembre y 1 y 6 enero CERRADO.;
;contenedor de aceite;;;;Calle  San Romualdo, 20;;Punto Limpio Fijo;;Calle;;San Romualdo;número;20;;;20;San Blas-Canillejas;447149,39;4476848,66;40,440601;-3,6231781;Lunes a Sabado 8:00 a 20:00. Domingo y festivos 9:00 a 14:00.  24 y 31 de diciembre 8:00 a 14:00. 25 de diciembre y 1 y 6 enero CERRADO.;
;contenedor de aceite;;;;Calle  Úbeda, 6;;Punto Limpio Fijo ;;Calle;;Úbeda;número;6;;;08;Fuencarral-El Pardo;439270,21;4481531,53;40,482249;-3,7165229;Lunes a Sabado 8:00 a 20:00. Domingo y festivos 9:00 a 14:00.  24 y 31 de diciembre 8:00 a 14:00. 25 de diciembre y 1 y 6 enero CERRADO.;
;contenedor de aceite;;;;Calle  Cidro, 5;;Punto Limpio Fijo.;;Calle;;Cidro;número;5;;;11;Carabanchel;436684,01;4468898,80;40,368253;-3,7457733;Lunes a Sabado 8:00 a 20:00. Domingo y festivos 9:00 a 14:00.  24 y 31 de diciembre 8:00 a 14:00. 25 de diciembre y 1 y 6 enero CERRADO.;
;contenedor de aceite;;;;Calle  Alhaurín, 5;;Punto Limpio Fijo.;;Calle;;Alhaurín;número;5;;;21;Barajas;450379,25;4480535,38;40,474015;-3,5853826;Lunes a Sabado 8:00 a 20:00. Domingo y festivos 9:00 a 14:00.  24 y 31 de diciembre 8:00 a 14:00. 25 de diciembre y 1 y 6 enero CERRADO.;
